{"status": {"temperature": 25.5625, "light": 4095, "regul": "HALT", "fire": false, "heat": "OFF", "cold": "OFF", "fanspeed": 0}, "location": {"room": "312", "gps": {"lat": 43.62454, "lon": 7.050628}, "address": "Les lucioles"}, "regul": {"lt": 25, "ht": 26}, "info": {"ident": "ESP32", "user": "GR_F", "loc": "A Biot"}, "net": {"uptime": "NOP", "ssid": "NOP", "mac": "NOP", "ip": "NOP"}, "reporthost": {"target_ip": "127.0.0.1", "target_port": 1880, "sp": 2}}
